[
  {
    "id": "dostoevsky-valikhanov-1858",
    "pack": [
      "kz",
      "semey"
    ],
    "year": 1858,
    "lat": 50.411,
    "lng": 80.227,
    "place": {
      "kk": "Семей",
      "ru": "Семипалатинск",
      "en": "Semipalatinsk (Semey)"
    },
    "image": "images/dostoevsky-valikhanov-1858.jpg",
    "image_credit": {
      "author": "N. Leybin",
      "license": "Public domain",
      "source_url": "https://commons.wikimedia.org/wiki/File:Valikhanov.jpg"
    },
    "title": {
      "kk": "Достоевский мен Шоқан Уәлиханов Семейде",
      "ru": "Достоевский и Чокан Валиханов в Семипалатинске",
      "en": "Dostoevsky and Shokan Valikhanov in Semipalatinsk"
    },
    "explanation": {
      "kk": "Фёдор Достоевский каторгадан кейін 1854–1859 жылдары Семейде әскери қызметте болды. Мұнда ол қазақ ғалымы әрі саяхатшысы Шоқан Уәлихановпен дос болды; олардың бірге түскен суреті — қаланың ең танымал тарихи фотоларының бірі.",
      "ru": "После каторги Фёдор Достоевский в 1854–1859 годах служил в Семипалатинске. Здесь он подружился с казахским учёным и путешественником Чоканом Валихановым; их совместный снимок — одна из самых известных исторических фотографий города.",
      "en": "After penal servitude, Fyodor Dostoevsky served in Semipalatinsk in 1854–1859. There he befriended the Kazakh scholar and traveller Shokan Valikhanov; their joint photograph is one of the city's best-known historical images."
    },
    "clue": {
      "kk": "Әскери мундир және XIX ғасыр ортасындағы ерте фотосуреттің түрі.",
      "ru": "Военные мундиры и вид ранней фотографии середины XIX века.",
      "en": "Military uniforms and the look of an early mid-19th-century photograph."
    },
    "sources": [
      "https://ru.wikipedia.org/wiki/Валиханов,_Чокан_Чингисович",
      "https://ru.wikipedia.org/wiki/Достоевский,_Фёдор_Михайлович"
    ],
    "difficulty": 2,
    "verified_by": "Claude (сверено по источникам)"
  },
  {
    "id": "expo-2017",
    "pack": [
      "kz"
    ],
    "year": 2017,
    "lat": 51.09,
    "lng": 71.416,
    "place": {
      "kk": "Астана",
      "ru": "Астана",
      "en": "Astana"
    },
    "image": "images/expo-2017.jpg",
    "image_credit": {
      "author": "颲風",
      "license": "CC BY-SA 4.0",
      "source_url": "https://commons.wikimedia.org/wiki/File:Expo_2017_EXPO_Park.jpg"
    },
    "title": {
      "kk": "ЭКСПО-2017 «Болашақ энергиясы»",
      "ru": "EXPO-2017 «Энергия будущего»",
      "en": "EXPO 2017 'Future Energy'"
    },
    "explanation": {
      "kk": "2017 жылы 10 маусым – 10 қыркүйек аралығында Астанада «Болашақ энергиясы» тақырыбымен халықаралық ЭКСПО көрмесі өтті. Оның басты нысаны – «Нұр Әлем» шар павильоны; сурет көрме аумағын жоғарыдан көрсетеді.",
      "ru": "С 10 июня по 10 сентября 2017 года в Астане прошла международная выставка EXPO на тему «Энергия будущего». Её главный символ — павильон-шар «Нур Алем»; на снимке территория выставки сверху.",
      "en": "From 10 June to 10 September 2017 Astana hosted the international EXPO exhibition on the theme 'Future Energy'. Its centrepiece was the spherical Nur Alem pavilion; the photo shows the exhibition grounds from above."
    },
    "clue": {
      "kk": "Жаңа павильондар, шыны құрылыстар, алыстағы биік үйлер.",
      "ru": "Новые павильоны, стеклянные конструкции, высотки на горизонте.",
      "en": "New pavilions, glass structures, high-rises on the horizon."
    },
    "sources": [
      "https://ru.wikipedia.org/wiki/EXPO_2017"
    ],
    "difficulty": 1,
    "verified_by": "Claude (сверено по источникам)"
  },
  {
    "id": "semipalatinsk-bazaar-1885",
    "pack": [
      "kz",
      "semey"
    ],
    "year": 1885,
    "lat": 50.411,
    "lng": 80.227,
    "place": {
      "kk": "Семей",
      "ru": "Семипалатинск",
      "en": "Semipalatinsk (Semey)"
    },
    "image": "images/semipalatinsk-bazaar-1885.jpg",
    "image_credit": {
      "author": "Unknown photographer (Library of Congress)",
      "license": "Public domain",
      "source_url": "https://commons.wikimedia.org/wiki/File:Bazar_(i.e,_bazaar)_at_Semipalatinsk_(i.e,_Seme_i)_LCCN99615488.jpg"
    },
    "title": {
      "kk": "Семейдегі базар",
      "ru": "Базар в Семипалатинске",
      "en": "Bazaar in Semipalatinsk"
    },
    "explanation": {
      "kk": "Бұл суретті 1885 жылы Сібір мен Дала өлкесін аралаған америкалық журналист Джордж Кеннанның экспедициясы түсірген. Ертіс бойындағы Семей Ресей, қазақ даласы және Қытай арасындағы саудаға арналған ірі сауда орталығы болды.",
      "ru": "Снимок сделан в 1885 году экспедицией американского журналиста Джорджа Кеннана, путешествовавшего по Сибири и Степному краю. Семипалатинск на Иртыше был крупным торговым центром на пути между Россией, казахской степью и Китаем.",
      "en": "The photo was taken in 1885 by the expedition of American journalist George Kennan, who travelled across Siberia and the Steppe region. Semipalatinsk on the Irtysh was a major trading hub between Russia, the Kazakh steppe and China."
    },
    "clue": {
      "kk": "Ерте фотосурет, ағаш дүкендер, арбалар және орыс пен қазақ киімдерінің араласуы.",
      "ru": "Ранняя фотография, деревянные лавки, телеги и смесь русской и казахской одежды.",
      "en": "An early photograph, wooden stalls, carts and a mix of Russian and Kazakh clothing."
    },
    "sources": [
      "https://www.loc.gov/item/99615488/",
      "https://en.wikipedia.org/wiki/George_Kennan_(explorer)"
    ],
    "difficulty": 2,
    "verified_by": "Claude (сверено по источникам)"
  },
  {
    "id": "semipalatinsk-ferry-1885",
    "pack": [
      "kz",
      "semey"
    ],
    "year": 1885,
    "lat": 50.405,
    "lng": 80.24,
    "place": {
      "kk": "Семей, Ертіс өзені",
      "ru": "Семипалатинск, река Иртыш",
      "en": "Semipalatinsk, Irtysh River"
    },
    "image": "images/semipalatinsk-ferry-1885.jpg",
    "image_credit": {
      "author": "Unknown photographer (Library of Congress)",
      "license": "Public domain",
      "source_url": "https://commons.wikimedia.org/wiki/File:The_Ferry_at_Semapolatinsk_(i.e,_Seme_i)_LCCN99615508.jpg"
    },
    "title": {
      "kk": "Ертіс арқылы өтетін паром",
      "ru": "Паром через Иртыш",
      "en": "The ferry across the Irtysh"
    },
    "explanation": {
      "kk": "1885 жылы Джордж Кеннан экспедициясы түсірген Семейдегі паром. Ол кезде Ертістің үстінде көпір болмаған: адамдар мен жүктерді паромдармен өткізген, ал қаладағы алғашқы тұрақты көпірлер тек XX ғасырда салынды.",
      "ru": "Паром в Семипалатинске на снимке экспедиции Джорджа Кеннана 1885 года. Моста через Иртыш тогда не было: людей и грузы переправляли паромами, а постоянные мосты в городе появились только в XX веке.",
      "en": "The ferry at Semipalatinsk, photographed by George Kennan's expedition in 1885. There was no bridge across the Irtysh then: people and goods crossed by ferry, and permanent bridges appeared in the city only in the 20th century."
    },
    "clue": {
      "kk": "Кең өзен, ағаш паром және XIX ғасырдағы ақ-қара сурет.",
      "ru": "Широкая река, деревянный паром и чёрно-белый снимок XIX века.",
      "en": "A wide river, a wooden ferry and a 19th-century black-and-white print."
    },
    "sources": [
      "https://www.loc.gov/item/99615508/",
      "https://en.wikipedia.org/wiki/George_Kennan_(explorer)"
    ],
    "difficulty": 3,
    "verified_by": "Claude (сверено по источникам)"
  },
  {
    "id": "kazakh-aul-semipalatinsk-1885",
    "pack": [
      "kz",
      "semey"
    ],
    "year": 1885,
    "lat": 50.45,
    "lng": 80.2,
    "place": {
      "kk": "Семей маңындағы ауыл",
      "ru": "Аул под Семипалатинском",
      "en": "Aul near Semipalatinsk"
    },
    "image": "images/kazakh-aul-semipalatinsk-1885.jpg",
    "image_credit": {
      "author": "Unknown photographer (Library of Congress)",
      "license": "Public domain",
      "source_url": "https://commons.wikimedia.org/wiki/File:Group_in_Tatar,_Tartar_village_(i.e.,_Kazakh_aul)_near_Semipolatinsk_(i.e.,_Seme_i)_LCCN99615489.jpg"
    },
    "title": {
      "kk": "Семей маңындағы қазақ ауылы",
      "ru": "Казахский аул под Семипалатинском",
      "en": "A Kazakh aul near Semipalatinsk"
    },
    "explanation": {
      "kk": "1885 жылы Джордж Кеннан экспедициясы Семей маңындағы қазақ ауылын суретке түсірді. Ол кезде қазақтардың көбі әлі де киіз үйде тұрып, мал шаруашылығымен көшпелі немесе жартылай көшпелі өмір сүрген.",
      "ru": "В 1885 году экспедиция Джорджа Кеннана сфотографировала казахский аул под Семипалатинском. Большинство казахов тогда ещё жили в юртах и вели кочевое или полукочевое скотоводческое хозяйство.",
      "en": "In 1885 George Kennan's expedition photographed a Kazakh aul near Semipalatinsk. Most Kazakhs at the time still lived in yurts and practised nomadic or semi-nomadic herding."
    },
    "clue": {
      "kk": "Аттылы адамдар, дәстүрлі киім және ерте фотосуреттің сапасы.",
      "ru": "Всадники, традиционная одежда и качество ранней фотографии.",
      "en": "Riders, traditional clothing and the quality of an early photograph."
    },
    "sources": [
      "https://www.loc.gov/item/99615489/",
      "https://en.wikipedia.org/wiki/George_Kennan_(explorer)"
    ],
    "difficulty": 3,
    "verified_by": "Claude (сверено по источникам)"
  },
  {
    "id": "verny-cathedral-construction-1906",
    "pack": [
      "kz"
    ],
    "year": 1906,
    "lat": 43.2586,
    "lng": 76.9533,
    "place": {
      "kk": "Верный (Алматы)",
      "ru": "Верный (Алма-Ата)",
      "en": "Verny (Almaty)"
    },
    "image": "images/verny-cathedral-construction-1906.jpg",
    "image_credit": {
      "author": "Фото неизвестного мастера",
      "license": "Public domain",
      "source_url": "https://commons.wikimedia.org/wiki/File:Ascension_Cathedral_in_Verny88.jpg"
    },
    "title": {
      "kk": "Вознесение соборының құрылысы",
      "ru": "Строительство Вознесенского собора",
      "en": "Construction of the Ascension Cathedral"